{
  "type": "ledger_entry",
  "version": "0.1",
  "ledger_entry_id": "ledger_entry_test_001",
  "event_type": "SNAPSHOT_COMMITTED",
  "snapshot_id": "snap_test_001",
  "payload_hash": "sha256_payload_hash_test_001",
  "previous_entry_hash": "sha256_previous_entry_hash_test_001",
  "entry_timestamp": "2026-05-15T00:00:35Z",
  "entry_hash": "sha256_entry_hash_test_001"
}